{
  "$schema": "../../schemas/vocab.schema.json",
  "tags": [
    {
      "id": "tag_tool",
      "name": "a tool"
    },
    {
      "id": "tag_filter",
      "name": "an air filter"
    },
    {
      "id": "tag_gas_leak",
      "name": "gas leak",
      "hazard": true
    },
    {
      "id": "tag_machine",
      "name": "a machine"
    }
  ],
  "stats": [
    {
      "id": "stat_health",
      "name": "Health",
      "short": "HP",
      "kind": "pool",
      "role": "health"
    },
    {
      "id": "stat_power",
      "name": "Power",
      "short": "PWR",
      "budget": true
    },
    {
      "id": "stat_mass",
      "name": "Mass",
      "short": "MAS",
      "budget": true
    },
    {
      "id": "stat_heat",
      "name": "Heat",
      "short": "HT",
      "kind": "pool",
      "fills": true
    },
    {
      "id": "stat_initiative",
      "name": "Initiative",
      "short": "INI",
      "role": "initiative"
    },
    {
      "id": "stat_armor",
      "name": "Armor",
      "short": "ARM"
    },
    {
      "id": "stat_cargo",
      "name": "Cargo",
      "short": "CRG",
      "role": "cargo"
    }
  ],
  "damage_types": [
    {
      "id": "dmg_impact",
      "name": "Impact",
      "resisted_by": "stat_armor"
    },
    {
      "id": "dmg_toxic",
      "name": "Toxic"
    }
  ],
  "statuses": [
    {
      "id": "status_burning",
      "name": "Burning",
      "glyph": "*",
      "stacking": "stack",
      "max_stacks": 3,
      "on_turn": [
        {
          "op": "damage",
          "amount": {
            "min": 1,
            "max": 2
          },
          "damage_type": "dmg_toxic",
          "subject": "self"
        }
      ]
    },
    {
      "id": "status_stun",
      "name": "Stunned",
      "blocks_actions": true
    }
  ],
  "slot_types": [
    {
      "id": "slot_worn",
      "name": "Suit",
      "equip_at_workshop": true
    },
    {
      "id": "slot_back",
      "name": "Back",
      "equip_at_workshop": true
    },
    {
      "id": "slot_head",
      "name": "Head",
      "equip_at_workshop": true
    },
    {
      "id": "slot_hand",
      "name": "Hand",
      "equip_at_workshop": true
    }
  ],
  "sizes": [
    {
      "size": 0,
      "name": "tiny"
    },
    {
      "size": 1,
      "name": "small"
    },
    {
      "size": 2,
      "name": "medium"
    },
    {
      "size": 3,
      "name": "person"
    },
    {
      "size": 4,
      "name": "room"
    },
    {
      "size": 5,
      "name": "large"
    }
  ],
  "ranks": [
    {
      "rank": 0,
      "name": "Newcomer"
    },
    {
      "rank": 1,
      "name": "Regular"
    }
  ],
  "relation_levels": [
    {
      "min": -50,
      "name": "hostile"
    },
    {
      "min": 0,
      "name": "neutral"
    },
    {
      "min": 50,
      "name": "friendly"
    }
  ],
  "object_states": [
    {
      "id": "state_open",
      "name": "open"
    },
    {
      "id": "state_closed",
      "name": "closed"
    },
    {
      "id": "state_used",
      "name": "used"
    }
  ],
  "phases": [
    {
      "id": "phase_day",
      "name": "Day shift",
      "turns": 30
    },
    {
      "id": "phase_night",
      "name": "Night shift",
      "turns": 30
    }
  ],
  "factions": [
    {
      "id": "faction_crew",
      "name": "Station crew"
    }
  ],
  "flags": [
    {
      "id": "flag_power",
      "description": "Power reaches the storage terminal."
    }
  ],
  "grades": [
    {
      "id": "grade_common",
      "name": "Common",
      "colour": "grey",
      "order": 0
    },
    {
      "id": "grade_fine",
      "name": "Fine",
      "colour": "cyan",
      "order": 1
    }
  ]
}
